{
  "name": "BBL",
  "version": "01.09.00.00",
  "force_update": "0",
  "description": "Bambu Lab official vendor ecosystem profile",
  "machine_model_list": [
    { "name": "Bambu Lab X1 Carbon", "sub_path": "machine/Bambu Lab X1 Carbon.json" }
  ],
  "machine_list": [
    { "name": "Bambu Lab X1 Carbon 0.4 nozzle", "sub_path": "machine/Bambu Lab X1 Carbon 0.4 nozzle.json" }
  ],
  "process_list": [
    { "name": "0.20mm Standard @BBL X1C", "sub_path": "process/0.20mm Standard @BBL X1C.json" }
  ],
  "filament_list": [
    { "name": "Bambu PLA Basic", "sub_path": "filament/Bambu PLA Basic.json" }
  ]
}
